{
  "name": "localhost",
  "chainId": 31337,
  "sharedContracts": {
    "metroToken": "DEPLOY_MOCK",
    "lbRouter": "DEPLOY_MOCK",
    "lbFactory": "DEPLOY_MOCK"
  },
  "testAccounts": {
    "fundingAmount": "1000000",
    "count": 5
  },
  "vaults": [
    {
      "id": "ws-usdc",
      "enabled": true,
      "tokens": {
        "tokenX": {
          "address": "DEPLOY_MOCK",
          "symbol": "wS",
          "name": "Wrapped Sonic",
          "decimals": 18,
          "deployMock": true
        },
        "tokenY": {
          "address": "DEPLOY_MOCK",
          "symbol": "USDC",
          "name": "USD Coin",
          "decimals": 6,
          "deployMock": true
        }
      },
      "lbPair": {
        "address": "DEPLOY_MOCK",
        "deployMock": true,
        "binStep": 25,
        "activeId": 8388608
      },
      "deployment": {
        "vaultName": "Arca wS-USDC Vault",
        "vaultSymbol": "ARCA-wS-USDC",
        "amountXMin": "1000000000000000",
        "amountYMin": "1000000",
        "idSlippage": "5",
        "_comment": "feeRecipient is Hardhat's first default test account (account[0]) - automatically funded with 10,000 ETH for easy testing",
        "feeRecipient": "0xf39Fd6e51aad88F6F4ce6aB8827279cffFb92266"
      }
    },
    {
      "id": "metro-usdc",
      "enabled": true,
      "tokens": {
        "tokenX": {
          "address": "DEPLOY_MOCK",
          "symbol": "METRO",
          "name": "Metropolis",
          "decimals": 18,
          "deployMock": false,
          "_comment": "METRO token is shared across all vaults - will use the shared deployment"
        },
        "tokenY": {
          "address": "DEPLOY_MOCK",
          "symbol": "USDC",
          "name": "USD Coin",
          "decimals": 6,
          "deployMock": false,
          "_comment": "USDC will reuse the same deployment from ws-usdc vault"
        }
      },
      "lbPair": {
        "address": "DEPLOY_MOCK",
        "deployMock": true,
        "binStep": 25,
        "activeId": 8388608
      },
      "deployment": {
        "vaultName": "Arca METRO-USDC Vault",
        "vaultSymbol": "ARCA-METRO-USDC",
        "amountXMin": "1000000000000000",
        "amountYMin": "1000000",
        "idSlippage": "5",
        "_comment": "feeRecipient is Hardhat's first default test account (account[0]) - automatically funded with 10,000 ETH for easy testing",
        "feeRecipient": "0xf39Fd6e51aad88F6F4ce6aB8827279cffFb92266"
      }
    },
    {
      "id": "test1-test2",
      "enabled": true,
      "tokens": {
        "tokenX": {
          "address": "DEPLOY_MOCK",
          "symbol": "TEST1",
          "name": "Test Token 1",
          "decimals": 18,
          "deployMock": true
        },
        "tokenY": {
          "address": "DEPLOY_MOCK",
          "symbol": "TEST2",
          "name": "Test Token 2",
          "decimals": 18,
          "deployMock": true
        }
      },
      "lbPair": {
        "address": "DEPLOY_MOCK",
        "deployMock": true,
        "binStep": 25,
        "activeId": 8388608
      },
      "deployment": {
        "vaultName": "Arca TEST1-TEST2 Vault",
        "vaultSymbol": "ARCA-TEST1-TEST2",
        "amountXMin": "1000000000000000",
        "amountYMin": "1000000000000000",
        "idSlippage": "5",
        "_comment": "feeRecipient is Hardhat's first default test account (account[0]) - automatically funded with 10,000 ETH for easy testing",
        "feeRecipient": "0xf39Fd6e51aad88F6F4ce6aB8827279cffFb92266"
      }
    }
  ]
}